{
  "id": "validation-issue-228",
  "issue": 228,
  "timestamp": "2026-06-13T12:21:29Z",
  "validatedBy": "validate skill",
  "status": "PASS",
  "passedChecks": 7,
  "failedChecks": 0,
  "checks": [
    {
      "name": "review_artifact_present",
      "status": "PASS",
      "description": "Review artifact present and structurally valid",
      "details": {
        "status": "PASS"
      }
    },
    {
      "name": "acceptance_criteria_mapped",
      "status": "PASS",
      "description": "All acceptance criteria mapped to tests",
      "details": {
        "total": 5,
        "mapped": 5,
        "unmapped": [],
        "problems": []
      }
    },
    {
      "name": "module_boundaries",
      "status": "PASS",
      "description": "Module boundaries respected",
      "details": {
        "violations": [],
        "cycles": [],
        "modulesTouched": 0,
        "warning": null
      }
    },
    {
      "name": "module_md_sync",
      "status": "PASS",
      "description": "MODULE.md in sync for touched modules",
      "details": {
        "drift": [],
        "missingInterfaces": []
      }
    },
    {
      "name": "handoff_structure",
      "status": "PASS",
      "description": "No handoff on branch (skipped)",
      "details": {
        "required": false,
        "missingFields": []
      }
    },
    {
      "name": "adr_requirement",
      "status": "PASS",
      "description": "No architectural change detected",
      "details": {
        "architecturalChange": false,
        "adrPresent": false,
        "adrs": [],
        "adrProblems": {}
      }
    },
    {
      "name": "done_md_completion",
      "status": "PASS",
      "description": "done.md required checklist complete",
      "details": {
        "unchecked": []
      }
    }
  ],
  "overallSummary": "All validation checks passed.",
  "readyForMerge": true
}
